text,key_words
"Фигурное катание – это сложно-координационный, травмоопасный вид спорта, ко- торый имеет большие риски получения травм, где спортсмены, перемещаясь на коньках по льду (в основном под музыкальное сопровождение), выполняют дополнительные эле- менты. Истоки фигурного катания лежат в далеком прошлом и уходят корнями в бронзо- вый век. Человек научился быстро передвигаться по льду, когда прикрепил к обуви специ- альные приспособления из кости. В настоящее время коньки стали делать из железа, что помогло увеличить скорость катания, а вместе с тем выросло количество травм. 
Задачей исследования является оценка травмоопасности фигурного катания и изу- чение методов предотвращения травм. 
Главной задачей первых фигуристов было вычерчивать на льду разнообразные фи- гуры, сохраняя при этом красивую позу. После каждого выступления судьи выходили на лед и изучали оставленный фигуристом след, что составляло основу соревнования. 
Изменения пришли с появлением телевидения. Фигурное катание стало более зре- лищным видом спорта, которому свойственны смешанные упражнения, преобладающие ациклические движения. Динамическая работа дополняется значительной долей статиче- ских упражнений. В связи с этим занятия фигурным катанием развивают как статическую (изометрическую), так и динамическую (в частности, взрывную) силу. Многочисленные ускорения и замедления, наклоны и вращения, сложность сохранения равновесия на малой площади опоры повышают тонкость анализа положений и перемещений тела и развивают вестибулярный аппарат. Повышается мышечно-суставная и тактильная чувствительность, точность глазомера, дифференцировка слуховых ощущений, способность к комплексному восприятию информации от многих сенсорных систем (чувство льда). 
Переменная мощность работы требует развития соответствующих физиологиче- ских свойств организма, адаптации двигательного аппарата и вегетативных систем к рез- ким изменениям уровня рабочей активности. Это может быть обеспечено путем совершен- ствования регуляции перестроек различных функций, повышения скорости процессов вырабатывания и восстановления. Переключения мощности работы сопровождаются и пе- реключениями уровня энерготрат – от незначительных в обязательных программах, где не- высока скорость и велика доля статического компонента, до больших – при быстрых и ди- намичных произвольных упражнениях. По длительности выполнения произвольных программ (2–4,5 мин) они относятся к зоне субмаксимальной мощности. При такой дли- тельности упражнений образование энергии осуществляется как аэробным (окислитель- ным), так и анаэробным (гликолитическим) путем. Следовательно, для фигуриста важно развитие как аэробных возможностей организма (доставки кислорода работающим мышцам), так и анаэробных (способности выполнять работу за счет расщепления гликогена). 
Различают виды фигурного катания: мужское и женское одиночные катания; парное катание; спортивные танцы; синхронное катание. 
Самое опасное из них – парное катание, в котором партнеры не только катаются в унисон, исполняя движения в гармонии друг с другом, но и выполняют различные эле- менты: «поддержка», «выброс», «подкрутка» и «тодес», которые вообще не имеют анало- гов в одиночном катании. Поэтому все травмы, которым подвержены одиночники и тан- цоры, сопутствуют и парникам. 
Вдобавок ко всему, у партнеров есть своя специфика работы – силовые элементы, которые добавляют сложность и опасность парному катанию. За многие годы исследова- телями установлено, что травмы у фигуристов в парном катании в 1,5 раза больше, чем в одиночном и в 2 раза больше, чем в танцах на льду. 
Особо опасный элемент в парном катании – параллельное вращение, где все движе- ния исполнителей должны быть абсолютно синхронными. Стоит одному из спортсменов чуть замедлиться и для зрителя нарушится вся стройность композиции, а для самих фигу- ристов опасность серьезной травмы возрастет в разы. 
В парном катании фигуристка, как правило, ниже своего партнера, поэтому она рис- кует значительно больше. Во время параллельных вращений ее лицо может оказаться в проекции движения конька её партнера. В парном катании есть фактор риска, который от- сутствует у одиночников – это риск получить серьезную травму лезвием конька при паде- нии. Раны от удара лезвием конька – самые опасные и могут иметь тяжелейшие послед- ствия. Они на первом месте по тяжести повреждений. 30% всех несчастных случаев в парном фигурном катании заканчиваются сотрясением мозга. От удара расположенное глу- боко внутри мозга мозолистое тело (сплетение нервных волокон в головном мозге чело- века, которое соединяет правое и левое полушария) колеблется быстрее и интенсивнее. Именно сильные колебания этой области после удара создают значительную нагрузку на окружающие ткани и могут привести к потере сознания и другим проявлениям черепно- мозговой травмы, которые испытывают и кора, и полушарие. К сожалению, у спортсменов, которые профессионально занимаются спортом, большинство сотрясений не регистриру- ются и не лечатся, и могут привести к ухудшениям памяти, неврозам и напомнить о себе через десятки лет. 
Также в парном катании есть еще одна опасность – это травмы, полученные во время поддержек и выбросов, выполняя выбросы или поддержки (стандартная высота около двух метров), спортсмены могут совершить неисправимые ошибки. Чаще всего партнерши по- лучают травмы при падении (скорость составляет 20–25 км/ч), а также при форс-мажорных обстоятельствах, когда конек партнера попадает в дугу-след. 
Чтобы снизить риск травмы при падении, прямой удар нужно превратить в скользя- щий. Если фигурист во время падения направит партнершу вдоль льда, закрутив ее, то пря- мой удар превратится в скользящий, и девушка, вероятно, не получит серьезных поврежде- ний. Принять правильное решение за долю секунды, в тот момент, когда ты испытываешь мощнейшие нагрузки и находишься в движении, – это задача огромной сложности. Как правило, если в парном катании один партнер ошибается, второй уже не в силах исправить ситуацию. Партнеру наносится психологическая травма в результате интенсивного остро- эмоционального, стрессового воздействия на его психику, вследствие нанесенного вреда партнёрше. 
Пара на льду существует как единый организм, чья-то малейшая неточность – след- ствие – страдают оба партнера. 
Год от года появляются всё новые элементы, программа усложняется, фигуристы далеко не всегда успевают адаптироваться к изменяющимся требованиям, часто травмиру- ются как на соревнованиях, так и на тренировках. Для того, чтобы одержать победу в со- ревновании, фигурист должен выполнить все установленные технические требования, ко- торые каждый год значительно усложняются Международным союзом конькобежцев. 
Поэтому нужен правильный подход к оценке функционального состояния фигури- стов, которое определяет спортивную форму спортсмена. Таким образом, должна быть учтена психологическая составляющая, тогда функциональное состояние будет включать в себя: первое – морфологическую (пластическую), второе – функциональную и третье – психологическую составляющую. 
У всех фигуристов травмы чаще всего возникают в области лодыжки, на втором ме- сте – колено, на третьем – поясница. Эти повреждения вызваны падениями и чрезмерной ударной нагрузкой. 
Один из важных элементов фигурного катания – это прыжки. 
Виды прыжков: тулуп; сальхов ритбергер; лутц; аксель; флип. Они отличаются по технике, но суть одна – спортсмен на скорости должен «оторвать» свое тело ото льда, совершить группировку и вращение в воздухе и красиво приземлиться на одну ногу. Осо- бенно сложные прыжки у одиночников в 3, а то и в 4 оборота каскадом. Кроме обычной травмы при прыжке, фигурист может получить и скрытые повреждения, а их последствия могут быть катастрофическими. Для фигуристов характерны осевые и вращательные нагрузки. Такая специфика приводит к тому, что резко возрастает давление на диски и тела позвонков, происходит их сжатие, что может привести к компрессионному перелому по- звоночника. 
Частые падения, без которых спортсмену не отработать прыжок, дополнительно нагружают позвоночник. Профессиональный спортсмен, как правило, приземляется на одну ногу, поэтому происходит разрушение тазобедренного сустава. 
Ассиметричная нагрузка действует на весь опорно-двигательный аппарат, этот про- цесс продолжается годами. В фигурном катании травмы и их последствия могут иметь накопительный эффект, что в дальнейшем может привести к серьезным последствиям. 
Чтобы достичь высот в фигурном катании, необходимо начать заниматься уже в 3 года. С 3,5 лет до 6 дети проходят подготовительные упражнения в спортшколе. Профес- сиональные занятия фигурным катаниям начинаются с 6-ти лет. В 7 лет молодой фигурист должен выполнять прыжок в 2 оборота, а в 10 лет – в 3 оборота. Все сложные элементы фигуристы должны усвоить максимум до 11 лет. 
Исключить болезненные падения невозможно, но уменьшить их количество – ре- ально. Для более безопасного выполнения прыжков, тренеры используют устройство под названием «Лонжа», с помощью которого предотвращаются падения и создаются облег- чённые условия для прыжка. 
Большое место в подготовке фигуристов должны занимать занятия вне катка: в тре- нажёрном зале, бассейне, танцевальном классе с соблюдением методических принципов подготовки спортсменов – поэтапное усложнение и увеличение нагрузок. 
Для того, чтобы избежать травм, обоснованно составить программу тренировок, фи- гуристам нужен точный расчёт. С помощью разработанной компьютерной программы мо- делирования прыжков и вращения спортсменов, возможно определить положение рук и головы, фигуриста чтобы безопасно увеличить скорость вращения. Комфортный предел для фигуристов составляет (около 330 оборотов в минуту необходимо 0,65 секунды), а для четвёртого прыжка – 430 оборотов в минуту потребуется 0,75 секунды. 
В основном, в парном катании, травмам подвергается именно фигуристка. Для ее защиты, на голову надевают мягкий шлем, а специальный корсет смягчает последствия асимметричной нагрузки, но подобная защита не используется на выступлениях. Это объ- ясняется тем, что фигурное катание – это эстетичный вид спорта, искусство. Для красоты линий и движений, передачи духа танца невозможно использовать защиту. 
Единственное, что действительно может спасти фигуристов от травм и помочь при перегрузках – это восстановление правильного мышечного корсета тела. Работа над мыш- цами, которые не задействованы в прыжках и вращениях, поможет компенсировать асим- метрию тела человека. 
Таким образом, можно сделать вывод, что опасность фигурного катания становится с каждым годом более высокой, так как различные повреждения связочно-капсульного ап- парата суставов, мышц, переломы, гематомы и ушибы мягких тканей усугубляют про- блемы в позвоночнике и деформируют его естественные изгибы (повреждения в пояснич- ном отделе) позвоночника. Это приводит к возникновению сколиотической болезни. Прыжковая нагрузка провоцирует появление межпозвоночных грыж, в некоторых ситуа- циях может произойти и компрессионный перелом. 
Фигурное катание — один из самых изящных видов спорта, в котором предел чело- веческих возможностей ещё не достигнут. Каждый год сложность технических элементов возрастает. Вот уже больше века эти соревнования — настоящее шоу. В спорте высших достижений во всех видах спортсмены действует на пределе своих возможностей, поэтому травмы получаются из самой сущности. Уровень состояния физического и психического компонентов здоровья, качества жизни спортсменов и спортсменок неравноценен. Если соблюдать все методические принципы и грамотно подходить ко всем разделам спортив- ной тренировки, можно снизить риск получения травмы. 
","фигурное катание, спортивные травмы, фигурные элементы, парное катание, лечение травм, происхождение"
